course_title,course_organization,course_Certificate_type,course_rating,course_difficulty,course_students_enrolled,students_enrolled_numeric,combined_features,difficulty_encoded,certificate_encoded,popularity_score,cluster
object oriented java programming data structures and beyond,university of california san diego,specialization,4.7,intermediate,250k,250000.0,object oriented java programming data structures and beyond university of california san diego specialization intermediate,2,2,0.6678560881671323,9
object oriented programming in java,duke university,specialization,4.6,beginner,330k,330000.0,object oriented programming in java duke university specialization beginner,1,2,0.6841444473612435,3
object oriented data structures in c,university of illinois at urbana champaign,course,4.7,intermediate,21k,21000.0,object oriented data structures in c university of illinois at urbana champaign course intermediate,2,0,0.3517524230378841,1
object oriented design,university of alberta,course,4.7,intermediate,33k,33000.0,object oriented design university of alberta course intermediate,2,0,0.4094329822473752,2
oil gas industry operations and markets,duke university,course,4.8,mixed,57k,57000.0,oil gas industry operations and markets duke university course mixed,3,0,0.4983249205933036,7
open source software development linux and git,the linux foundation,specialization,4.4,beginner,13k,13000.0,open source software development linux and git the linux foundation specialization beginner,1,2,0.2331231668574291,3
operating systems and you becoming a power user,google,course,4.6,beginner,76k,76000.0,operating systems and you becoming a power user google course beginner,1,0,0.4967523352960805,3
operations analytics,university of pennsylvania,course,4.7,mixed,80k,80000.0,operations analytics university of pennsylvania course mixed,3,0,0.5224414919624327,7
optical engineering,university of colorado boulder,specialization,4.2,advanced,6.2k,6200.0,optical engineering university of colorado boulder specialization advanced,0,2,0.1003570921750756,3
organizational leadership,northwestern university,specialization,4.7,intermediate,92k,92000.0,organizational leadership northwestern university specialization intermediate,2,2,0.5402778351693631,2
osteoarchaeology the truth in our bones,universiteit leiden,course,4.7,beginner,22k,22000.0,osteoarchaeology the truth in our bones universiteit leiden course beginner,1,0,0.3576890752119981,3
palliative care it s not just hospice anymore,university of colorado system,specialization,4.8,beginner,3.2k,3200.0,palliative care it s not just hospice anymore university of colorado system specialization beginner,1,2,0.1308269365079108,3
palo alto networks cybersecurity,palo alto networks,specialization,4.6,beginner,9.1k,9100.0,palo alto networks cybersecurity palo alto networks specialization beginner,1,2,0.2258944637959876,3
parallel concurrent and distributed programming in java,rice university,specialization,4.5,intermediate,30k,30000.0,parallel concurrent and distributed programming in java rice university specialization intermediate,2,2,0.3589835099077265,2
particle physics an introduction,university of geneva,course,4.5,mixed,42k,42000.0,particle physics an introduction university of geneva course mixed,3,0,0.4019231996004579,7
patient safety,johns hopkins university,specialization,4.8,beginner,8.8k,8800.0,patient safety johns hopkins university specialization beginner,1,2,0.2599030279371273,4
patrocinio deportivo,universitat aut noma de barcelona,course,4.6,beginner,12k,12000.0,patrocinio deportivo universitat aut noma de barcelona course beginner,1,0,0.2611951425719176,3
people analytics,university of pennsylvania,course,4.5,mixed,84k,84000.0,people analytics university of pennsylvania course mixed,3,0,0.4903817791387195,7
perfect tenses and modals,university of california irvine,course,4.7,intermediate,79k,79000.0,perfect tenses and modals university of california irvine course intermediate,2,0,0.5208361960722723,9
periodismo digital y combate a las fake news,universidad nacional aut noma de m xico,course,4.9,beginner,8.9k,8900.0,periodismo digital y combate a las fake news universidad nacional aut noma de m xico course beginner,1,0,0.2804880668168796,3
photography basics and beyond from smartphone to dslr,michigan state university,specialization,4.7,beginner,160k,160000.0,photography basics and beyond from smartphone to dslr michigan state university specialization beginner,1,2,0.6109007931471058,0
plant bioinformatic methods,university of toronto,specialization,4.7,beginner,83k,83000.0,plant bioinformatic methods university of toronto specialization beginner,1,2,0.5271396683741183,3
politics and economics of international energy,sciences po,course,4.7,beginner,34k,34000.0,politics and economics of international energy sciences po course beginner,1,0,0.4132427319007079,3
positive psychiatry and mental health,the university of sydney,course,4.8,mixed,72k,72000.0,positive psychiatry and mental health the university of sydney course mixed,3,0,0.5281386024261714,7
positive psychology,the university of north carolina at chapel hill,course,4.7,mixed,180k,180000.0,positive psychology the university of north carolina at chapel hill course mixed,3,0,0.625932286939527,7
positive psychology applications and interventions,university of pennsylvania,course,4.8,beginner,23k,23000.0,positive psychology applications and interventions university of pennsylvania course beginner,1,0,0.3825049408727006,7
positive psychology martin e p seligman s visionary science,university of pennsylvania,course,4.8,beginner,50k,50000.0,positive psychology martin e p seligman s visionary science university of pennsylvania course beginner,1,0,0.4816032832587593,7
positive psychology resilience skills,university of pennsylvania,course,4.6,beginner,40k,40000.0,positive psychology resilience skills university of pennsylvania course beginner,1,0,0.4148398465061889,7
power electronics,university of colorado boulder,specialization,4.8,intermediate,67k,67000.0,power electronics university of colorado boulder specialization intermediate,2,2,0.5189534086018535,2
practical data science with matlab,mathworks,specialization,4.7,beginner,10k,10000.0,practical data science with matlab mathworks specialization beginner,1,2,0.257072361742785,3
practical time series analysis,the state university of new york,course,4.6,intermediate,39k,39000.0,practical time series analysis the state university of new york course intermediate,2,0,0.4116088457101816,0
preparing for the google cloud associate cloud engineer exam,google cloud,course,4.7,beginner,22k,22000.0,preparing for the google cloud associate cloud engineer exam google cloud course beginner,1,0,0.3576890752119981,8
preparing to manage human resources,university of minnesota,course,4.8,mixed,68k,68000.0,preparing to manage human resources university of minnesota course mixed,3,0,0.5208440958516478,7
presentation skills speechwriting slides and delivery,e learning development fund,specialization,4.6,beginner,47k,47000.0,presentation skills speechwriting slides and delivery e learning development fund specialization beginner,1,2,0.4354205648672473,2
pricing strategy optimization,bcg,specialization,4.8,beginner,20k,20000.0,pricing strategy optimization bcg specialization beginner,1,2,0.3646692218621901,3
primeros auxilios psicol gicos pap,universitat aut noma de barcelona,course,4.8,mixed,280k,280000.0,primeros auxilios psicol gicos pap universitat aut noma de barcelona course mixed,3,0,0.7014622893654425,3
private equity and venture capital,universit bocconi,course,4.8,mixed,79k,79000.0,private equity and venture capital universit bocconi course mixed,3,0,0.5399793379523228,7
probabilistic graphical models 1 representation,stanford university,course,4.7,advanced,68k,68000.0,probabilistic graphical models 1 representation stanford university course advanced,0,0,0.5017009539715969,3
probability and statistics to p or not to p,university of london,course,4.6,beginner,36k,36000.0,probability and statistics to p or not to p university of london course beginner,1,0,0.4013939923341745,3
process mining data science in action,eindhoven university of technology,course,4.8,intermediate,39k,39000.0,process mining data science in action eindhoven university of technology course intermediate,2,0,0.4498951294702826,2
programming foundations with javascript html and css,duke university,course,4.6,beginner,250k,250000.0,programming foundations with javascript html and css duke university course beginner,1,0,0.6487129462870818,3
programming fundamentals,duke university,course,4.7,beginner,19k,19000.0,programming fundamentals duke university course beginner,1,0,0.3389803170631267,3
programming for everybody getting started with python,university of michigan,course,4.8,mixed,1.3m,1300000.0,programming for everybody getting started with python university of michigan course mixed,3,0,0.8974021909435961,5
programming with google go,university of california irvine,specialization,4.6,intermediate,18k,18000.0,programming with google go university of california irvine specialization intermediate,2,2,0.312937438404639,9
project execution,university of california irvine,course,4.2,beginner,70k,70000.0,project execution university of california irvine course beginner,1,0,0.4096846078239951,9
project launch,university of california irvine,course,4.7,beginner,190k,190000.0,project launch university of california irvine course beginner,1,0,0.6328323595425758,9
project management other tools for career development,university of california irvine,specialization,4.6,beginner,440k,440000.0,project management other tools for career development university of california irvine specialization beginner,1,2,0.720858608874241,9
project management principles and practices,university of california irvine,specialization,4.7,beginner,230k,230000.0,project management principles and practices university of california irvine specialization beginner,1,2,0.6572148927561274,9
psychological first aid,johns hopkins university,course,4.8,mixed,190k,190000.0,psychological first aid johns hopkins university course mixed,3,0,0.6519755014226263,4
public policy challenges of the 21st century,university of virginia,course,4.6,beginner,52k,52000.0,public policy challenges of the 21st century university of virginia course beginner,1,0,0.4483222858408258,3
python basics,university of michigan,course,4.8,beginner,110k,110000.0,python basics university of michigan course beginner,1,0,0.5822255651559973,5
python classes and inheritance,university of michigan,course,4.7,intermediate,21k,21000.0,python classes and inheritance university of michigan course intermediate,2,0,0.3517524230378841,5
python data structures,university of michigan,course,4.9,mixed,420k,420000.0,python data structures university of michigan course mixed,3,0,0.7723511199290782,5
python functions files and dictionaries,university of michigan,course,4.8,beginner,26k,26000.0,python functions files and dictionaries university of michigan course beginner,1,0,0.3981509249709853,5
python and statistics for financial analysis,the hong kong university of science and technology,course,4.4,intermediate,41k,41000.0,python and statistics for financial analysis the hong kong university of science and technology course intermediate,2,0,0.3797047795050705,2
python for data science and ai,ibm,course,4.6,beginner,170k,170000.0,python for data science and ai ibm course beginner,1,0,0.5994945759269172,5
python for everybody,university of michigan,specialization,4.8,beginner,1.5m,1500000.0,python for everybody university of michigan specialization beginner,1,2,0.915664842874066,5
quantitative methods,university of amsterdam,course,4.7,mixed,69k,69000.0,quantitative methods university of amsterdam course mixed,3,0,0.5035640393629541,7
queering identities lgbtq sexuality and gender identity,university of colorado system,course,4.9,beginner,3k,3000.0,queering identities lgbtq sexuality and gender identity university of colorado system course beginner,1,0,0.1417362691869488,3
r programming,johns hopkins university,course,4.6,intermediate,480k,480000.0,r programming johns hopkins university course intermediate,2,0,0.7319630589362669,4
ready set future introduction to futures thinking,institute for the future,course,4.8,beginner,7.7k,7700.0,ready set future introduction to futures thinking institute for the future course beginner,1,0,0.2428636968238349,3
recommender systems,university of minnesota,specialization,4.3,intermediate,29k,29000.0,recommender systems university of minnesota specialization intermediate,2,2,0.3163708247421843,2
recruiting hiring and onboarding employees,university of minnesota,course,4.7,mixed,35k,35000.0,recruiting hiring and onboarding employees university of minnesota course mixed,3,0,0.4169420415334435,7
reinforcement learning,university of alberta,specialization,4.7,intermediate,23k,23000.0,reinforcement learning university of alberta specialization intermediate,2,2,0.3633617989926501,2
renewable energy and green building entrepreneurship,duke university,course,4.7,beginner,24k,24000.0,renewable energy and green building entrepreneurship duke university course beginner,1,0,0.3687930660529881,3
reporting extra financier et strat gie rse,essec business school,course,4.7,beginner,5.2k,5200.0,reporting extra financier et strat gie rse essec business school course beginner,1,0,0.1736294261183915,6
requirements engineering secure software specifications,university of colorado system,specialization,4.6,beginner,7.2k,7200.0,requirements engineering secure software specifications university of colorado system specialization beginner,1,2,0.1960101825586542,3
research data management and sharing,the university of edinburgh,course,4.6,mixed,16k,16000.0,research data management and sharing the university of edinburgh course mixed,3,0,0.2979067421913424,7
resilience in children exposed to trauma disaster and war global perspectives,university of minnesota,course,4.8,mixed,15k,15000.0,resilience in children exposed to trauma disaster and war global perspectives university of minnesota course mixed,3,0,0.3279570905586095,7
responsive website development and design,goldsmiths university of london,specialization,4.5,beginner,170k,170000.0,responsive website development and design goldsmiths university of london specialization beginner,1,2,0.5803514340468672,3
rethinking international tax law,universiteit leiden,course,4.9,mixed,36k,36000.0,rethinking international tax law universiteit leiden course mixed,3,0,0.4588234179743256,7
revis o sistem tica e meta an lise,universidade estadual de campinas,course,4.9,intermediate,17k,17000.0,revis o sistem tica e meta an lise universidade estadual de campinas course intermediate,2,0,0.363072670244343,2
robotics,university of pennsylvania,specialization,4.4,beginner,120k,120000.0,robotics university of pennsylvania specialization beginner,1,2,0.5167573751867103,7
roman architecture,yale university,course,4.9,beginner,30k,30000.0,roman architecture yale university course beginner,1,0,0.4355560774279285,3
russian alphabet,saint petersburg state university,course,4.7,beginner,3.2k,3200.0,russian alphabet saint petersburg state university course beginner,1,0,0.1116837946278606,0
russian for beginners 1 a1,saint petersburg state university,specialization,4.7,beginner,7k,7000.0,russian for beginners 1 a1 saint petersburg state university specialization beginner,1,2,0.2115586368353037,0
r ussir le changement,essec business school,course,4.5,mixed,33k,33000.0,r ussir le changement essec business school course mixed,3,0,0.3711466984872746,6
sas programmer,sas,professional certificate,4.8,beginner,370k,370000.0,sas programmer sas professional certificate beginner,1,1,0.7370318465470804,3
sas visual business analytics,sas,professional certificate,4.6,beginner,2.6k,2600.0,sas visual business analytics sas professional certificate beginner,1,1,0.0660507208423772,6
sql for data science,university of california davis,course,4.6,beginner,160k,160000.0,sql for data science university of california davis course beginner,1,0,0.5917576512670553,9
sales operations management,west virginia university,specialization,4.4,beginner,5.6k,5600.0,sales operations management west virginia university specialization beginner,1,2,0.125655977270835,3
sales training for high performing teams,hubspot academy,specialization,4.7,beginner,16k,16000.0,sales training for high performing teams hubspot academy specialization beginner,1,2,0.3170498840713929,3
sample based learning methods,university of alberta,course,4.8,intermediate,6.8k,6800.0,sample based learning methods university of alberta course intermediate,2,0,0.2270028979859786,2
scaling operations linking strategy and execution,northwestern university,course,4.5,mixed,12k,12000.0,scaling operations linking strategy and execution northwestern university course mixed,3,0,0.2420520006918671,7
school health for children and adolescents,university of colorado system,specialization,4.8,beginner,9.1k,9100.0,school health for children and adolescents university of colorado system specialization beginner,1,2,0.2641807475560886,6
science of exercise,university of colorado boulder,course,4.8,beginner,140k,140000.0,science of exercise university of colorado boulder course beginner,1,0,0.6130026463439866,3
search engine optimization fundamentals,university of california davis,course,4.7,mixed,47k,47000.0,search engine optimization fundamentals university of california davis course mixed,3,0,0.4545637067472978,9
secure coding practices,university of california davis,specialization,4.4,intermediate,6.4k,6400.0,secure coding practices university of california davis specialization intermediate,2,2,0.142694531695507,9
security safety challenges in a globalized world,universiteit leiden,course,4.7,beginner,14k,14000.0,security safety challenges in a globalized world universiteit leiden course beginner,1,0,0.3000096208381451,3
security in google cloud platform,google cloud,specialization,4.7,intermediate,300k,300000.0,security in google cloud platform google cloud specialization intermediate,2,2,0.6911240526168028,8
self driving cars,university of toronto,specialization,4.7,advanced,39k,39000.0,self driving cars university of toronto specialization advanced,0,2,0.4307519875902326,3
sequence models,deeplearning ai,course,4.8,intermediate,14k,14000.0,sequence models deeplearning ai course intermediate,2,0,0.3191527627181956,2
sexualidad mucho m s que sexo,universidad de los andes,course,4.8,beginner,110k,110000.0,sexualidad mucho m s que sexo universidad de los andes course beginner,1,0,0.5822255651559973,3
sharpened visions a poetry workshop,california institute of the arts,course,4.7,beginner,61k,61000.0,sharpened visions a poetry workshop california institute of the arts course beginner,1,0,0.487837215794344,9
site reliability engineering measuring and managing reliability,google cloud,course,4.5,advanced,16k,16000.0,site reliability engineering measuring and managing reliability google cloud course advanced,0,0,0.2787636003112919,8
six sigma green belt,university system of georgia,specialization,4.7,intermediate,18k,18000.0,six sigma green belt university system of georgia specialization intermediate,2,2,0.3320805802846895,2
six sigma and the organization advanced,university system of georgia,course,4.7,intermediate,15k,15000.0,six sigma and the organization advanced university system of georgia course intermediate,2,0,0.3088139486785595,2
sleep neurobiology medicine and society,university of michigan,course,4.8,beginner,20k,20000.0,sleep neurobiology medicine and society university of michigan course beginner,1,0,0.3646692218621901,3
smart cities management of smart urban infrastructures,cole polytechnique f d rale de lausanne,course,4.6,beginner,22k,22000.0,smart cities management of smart urban infrastructures cole polytechnique f d rale de lausanne course beginner,1,0,0.3385459333319476,3
social entrepreneurship,copenhagen business school,specialization,4.6,beginner,13k,13000.0,social entrepreneurship copenhagen business school specialization beginner,1,2,0.2714094506175302,6
social media marketing,northwestern university,specialization,4.6,beginner,130k,130000.0,social media marketing northwestern university specialization beginner,1,2,0.5652587032022209,3
social norms social change i,university of pennsylvania,course,4.6,beginner,78k,78000.0,social norms social change i university of pennsylvania course beginner,1,0,0.5000673083837799,7
social policy for social services health practitioners,columbia university,specialization,4.8,beginner,4.2k,4200.0,social policy for social services health practitioners columbia university specialization beginner,1,2,0.1655218814983647,3
social psychology,wesleyan university,course,4.7,beginner,220k,220000.0,social psychology wesleyan university course beginner,1,0,0.6515419419928006,3
social and economic networks models and analysis,stanford university,course,4.8,advanced,42k,42000.0,social and economic networks models and analysis stanford university course advanced,0,0,0.4593526252406095,3
software design and architecture,university of alberta,specialization,4.6,beginner,60k,60000.0,software design and architecture university of alberta specialization beginner,1,2,0.4665846236332931,3
software development lifecycle,university of minnesota,specialization,4.6,intermediate,34k,34000.0,software development lifecycle university of minnesota specialization intermediate,2,2,0.3940995900206574,2
software processes and agile practices,university of alberta,course,4.7,mixed,60k,60000.0,software processes and agile practices university of alberta course mixed,3,0,0.4857277655133436,7
software product management,university of alberta,specialization,4.6,beginner,110k,110000.0,software product management university of alberta specialization beginner,1,2,0.5439392813958963,3
solar energy basics,the state university of new york,course,4.8,beginner,17k,17000.0,solar energy basics the state university of new york course beginner,1,0,0.3439295283642924,0
songwriting writing the lyrics,berklee college of music,course,4.8,beginner,68k,68000.0,songwriting writing the lyrics berklee college of music course beginner,1,0,0.5208440958516478,3
soporte de tecnolog as de la informaci n de google,crece con google,professional certificate,4.9,beginner,8.8k,8800.0,soporte de tecnolog as de la informaci n de google crece con google professional certificate beginner,1,1,0.2790461698171773,8
spacecraft dynamics and control,university of colorado boulder,specialization,4.8,advanced,12k,12000.0,spacecraft dynamics and control university of colorado boulder specialization advanced,0,2,0.2994814263320182,3
spanish vocabulary meeting people,university of california davis,course,4.6,beginner,71k,71000.0,spanish vocabulary meeting people university of california davis course beginner,1,0,0.4880674062007539,9
speak english professionally in person online on the phone,georgia institute of technology,course,4.6,mixed,430k,430000.0,speak english professionally in person online on the phone georgia institute of technology course mixed,3,0,0.7179246715586558,7
sports marketing,northwestern university,course,4.7,intermediate,12k,12000.0,sports marketing northwestern university course intermediate,2,0,0.2803382844519682,2
sports and society,duke university,course,4.8,mixed,16k,16000.0,sports and society duke university course mixed,3,0,0.3361930259514429,7
stanford introduction to food and health,stanford university,course,4.7,beginner,370k,370000.0,stanford introduction to food and health stanford university course beginner,1,0,0.7178887046670295,3
stanford s short course on breastfeeding,stanford university,course,4.7,beginner,17k,17000.0,stanford s short course on breastfeeding stanford university course beginner,1,0,0.3247863864842419,3
statistical analysis with r for public health,imperial college london,specialization,4.7,beginner,16k,16000.0,statistical analysis with r for public health imperial college london specialization beginner,1,2,0.3170498840713929,3
statistics with python,university of michigan,specialization,4.6,beginner,34k,34000.0,statistics with python university of michigan specialization beginner,1,2,0.3940995900206574,5
statistics with r,duke university,specialization,4.7,beginner,220k,220000.0,statistics with r duke university specialization beginner,1,2,0.6515419419928006,3
stories of infection,stanford university,course,4.9,intermediate,28k,28000.0,stories of infection stanford university course intermediate,2,0,0.4267514457595878,2
strategic business analytics,essec business school,specialization,4.3,advanced,60k,60000.0,strategic business analytics essec business school specialization advanced,0,2,0.409155197993142,6
strategic business management microeconomics,university of california irvine,course,4.7,beginner,9.5k,9500.0,strategic business management microeconomics university of california irvine course beginner,1,0,0.2505269346166705,9
strategic leadership and management,university of illinois at urbana champaign,specialization,4.7,beginner,100k,100000.0,strategic leadership and management university of illinois at urbana champaign specialization beginner,1,2,0.5509189639964993,1
strategic management,copenhagen business school,course,4.7,mixed,58k,58000.0,strategic management copenhagen business school course mixed,3,0,0.4814012907662617,6
strategic management and innovation,copenhagen business school,specialization,4.7,beginner,68k,68000.0,strategic management and innovation copenhagen business school specialization beginner,1,2,0.5017009539715969,6
strategic sales management,funda o instituto de administra o,specialization,4.5,intermediate,9.2k,9200.0,strategic sales management funda o instituto de administra o specialization intermediate,2,2,0.2081459478135374,2
